[
  {
    "schema_version": "3.0",
    "candidate_id": "runtime:codex",
    "runtime_id": "codex",
    "runtime_name": "Codex",
    "observed_version": "codex-cli 0.153.4",
    "release_tag": "rust-v0.153.4",
    "release_commit": "3d2ee51ca2d5db578f328aa75e20aa22c0197c9a",
    "documentation_snapshot": "https://developers.openai.com/codex/",
    "adapter_manifest_ref": "codex@fixture-1.0",
    "availability": "INSTALLED",
    "adapter_status": "IMPLEMENTED",
    "capabilities": {
      "editing": true,
      "skills": true,
      "persistent_context": true,
      "sandbox": true,
      "subagents": true,
      "MCP": true,
      "structured_output": true,
      "parallelism": true,
      "model_selection": true,
      "reasoning_effort": true,
      "long_context": true,
      "multimodal": true,
      "plugins": true,
      "hooks": true,
      "commands": true
    },
    "model_selection": {"task": "SUPPORTED", "stage": "TASK_PINNED", "subagent": "SUPPORTED", "step": "DESIGN_ONLY"},
    "permissions": {"policy_gated": true, "supported_levels": ["read-only", "workspace-write", "destructive"], "declared_scopes": ["workspace-read", "workspace-write", "network"]},
    "evidence_provenance": {
      "evidence_class": "REAL_EXECUTION",
      "source": "local-version-probe",
      "reference": "https://github.com/openai/codex/releases/tag/rust-v0.153.4",
      "method": "codex --version; release tag and commit resolved from official source",
      "notes": "Version provenance is real compatibility evidence, not task-quality evidence."
    }
  },
  {
    "schema_version": "3.0",
    "candidate_id": "runtime:claude-code",
    "runtime_id": "claude-code",
    "runtime_name": "Claude Code",
    "observed_version": "2.1.235",
    "release_tag": null,
    "release_commit": null,
    "documentation_snapshot": "https://docs.anthropic.com/en/docs/claude-code/cli-usage",
    "adapter_manifest_ref": "claude-code@fixture-1.0",
    "availability": "INSTALLED",
    "adapter_status": "GUIDE_ONLY",
    "capabilities": {
      "editing": true,
      "skills": true,
      "persistent_context": true,
      "sandbox": true,
      "subagents": true,
      "MCP": true,
      "structured_output": true,
      "parallelism": true,
      "model_selection": true,
      "reasoning_effort": true,
      "long_context": true,
      "multimodal": true,
      "plugins": true,
      "hooks": true,
      "commands": true
    },
    "model_selection": {"task": "SUPPORTED", "stage": "TASK_PINNED", "subagent": "UNKNOWN", "step": "UNKNOWN"},
    "permissions": {"policy_gated": true, "supported_levels": ["read-only", "workspace-write"], "declared_scopes": ["workspace-read", "workspace-write", "network"]},
    "evidence_provenance": {
      "evidence_class": "REAL_EXECUTION",
      "source": "local-version-probe",
      "reference": "https://docs.anthropic.com/en/docs/claude-code/cli-usage",
      "method": "claude --version",
      "notes": "No immutable release commit was resolved in this phase."
    }
  },
  {
    "schema_version": "3.0",
    "candidate_id": "runtime:opencode",
    "runtime_id": "opencode",
    "runtime_name": "OpenCode",
    "observed_version": "1.18.25",
    "release_tag": null,
    "release_commit": null,
    "documentation_snapshot": "https://opencode.ai/docs/skills",
    "adapter_manifest_ref": "opencode@fixture-1.0",
    "availability": "INSTALLED",
    "adapter_status": "GUIDE_ONLY",
    "capabilities": {
      "editing": true,
      "skills": true,
      "persistent_context": true,
      "sandbox": true,
      "subagents": true,
      "MCP": true,
      "structured_output": true,
      "parallelism": true,
      "model_selection": true,
      "reasoning_effort": true,
      "long_context": true,
      "plugins": true,
      "commands": true
    },
    "model_selection": {"task": "SUPPORTED", "stage": "UNKNOWN", "subagent": "SUPPORTED", "step": "UNKNOWN"},
    "permissions": {"policy_gated": true, "supported_levels": ["read-only", "workspace-write"], "declared_scopes": ["workspace-read", "workspace-write", "MCP"]},
    "evidence_provenance": {
      "evidence_class": "REAL_EXECUTION",
      "source": "local-version-probe",
      "reference": "https://opencode.ai/docs/agents/",
      "method": "opencode --version",
      "notes": "No immutable release commit was resolved in this phase."
    }
  },
  {
    "schema_version": "3.0",
    "candidate_id": "runtime:hermes",
    "runtime_id": "hermes",
    "runtime_name": "Hermes",
    "observed_version": "Hermes Agent v0.20.0 (2026.8.3)",
    "release_tag": null,
    "release_commit": null,
    "documentation_snapshot": "https://github.com/NousResearch/hermes-agent",
    "adapter_manifest_ref": "hermes@fixture-1.0",
    "availability": "INSTALLED",
    "adapter_status": "GUIDE_ONLY",
    "capabilities": {
      "editing": true,
      "skills": true,
      "persistent_context": true,
      "sandbox": true,
      "subagents": true,
      "MCP": true,
      "structured_output": true,
      "parallelism": true,
      "native_learning": true,
      "model_selection": true,
      "reasoning_effort": true,
      "long_context": true,
      "plugins": true,
      "hooks": true,
      "commands": true
    },
    "model_selection": {"task": "SUPPORTED", "stage": "TASK_PINNED", "subagent": "UNKNOWN", "step": "UNKNOWN"},
    "permissions": {"policy_gated": true, "supported_levels": ["read-only", "workspace-write"], "declared_scopes": ["workspace-read", "workspace-write", "MCP"]},
    "evidence_provenance": {
      "evidence_class": "REAL_EXECUTION",
      "source": "local-version-probe",
      "reference": "https://github.com/NousResearch/hermes-agent",
      "method": "hermes --version",
      "notes": "No immutable release commit was resolved in this phase."
    }
  },
  {
    "schema_version": "3.0",
    "candidate_id": "runtime:mimo-code",
    "runtime_id": "mimo-code",
    "runtime_name": "MiMo Code",
    "observed_version": null,
    "release_tag": null,
    "release_commit": null,
    "documentation_snapshot": null,
    "adapter_manifest_ref": "mimo-code@fixture-1.0",
    "availability": "UNKNOWN",
    "adapter_status": "UNVERIFIED",
    "capabilities": {"editing": true, "skills": true, "sandbox": true, "subagents": true, "MCP": true, "structured_output": true, "parallelism": true, "model_selection": true, "reasoning_effort": true, "long_context": true, "multimodal": true, "plugins": false, "hooks": false, "commands": true},
    "model_selection": {"task": "SUPPORTED", "stage": "UNKNOWN", "subagent": "SUPPORTED", "step": "UNKNOWN"},
    "permissions": {"policy_gated": true, "supported_levels": ["read-only", "workspace-write"], "declared_scopes": []},
    "evidence_provenance": {"evidence_class": "HOST_MANAGED_FIXTURE", "source": "checked-in capability fixture", "method": "static-contract-fixture", "notes": "No verified executable was probed; fixture is not live evidence."}
  },
  {
    "schema_version": "3.0",
    "candidate_id": "runtime:zcode",
    "runtime_id": "zcode",
    "runtime_name": "ZCode",
    "observed_version": null,
    "release_tag": null,
    "release_commit": null,
    "documentation_snapshot": null,
    "adapter_manifest_ref": "zcode@fixture-1.0",
    "availability": "UNKNOWN",
    "adapter_status": "UNVERIFIED",
    "capabilities": {"editing": true, "skills": true, "sandbox": true, "subagents": true, "MCP": true, "structured_output": true, "parallelism": true, "model_selection": true, "reasoning_effort": true, "long_context": true, "plugins": true, "hooks": true, "commands": true},
    "model_selection": {"task": "SUPPORTED", "stage": "UNKNOWN", "subagent": "SUPPORTED", "step": "UNKNOWN"},
    "permissions": {"policy_gated": true, "supported_levels": ["read-only", "workspace-write"], "declared_scopes": []},
    "evidence_provenance": {"evidence_class": "HOST_MANAGED_FIXTURE", "source": "checked-in capability fixture", "method": "static-contract-fixture", "notes": "No verified executable was probed; fixture is not live evidence."}
  },
  {
    "schema_version": "3.0",
    "candidate_id": "runtime:deepseek-harness",
    "runtime_id": "deepseek-harness",
    "runtime_name": "DeepSeek Harness",
    "observed_version": null,
    "release_tag": null,
    "release_commit": null,
    "documentation_snapshot": null,
    "adapter_manifest_ref": "deepseek-harness@fixture-1.0",
    "availability": "UNKNOWN",
    "adapter_status": "UNVERIFIED",
    "capabilities": {"editing": true, "skills": true, "sandbox": true, "subagents": true, "MCP": true, "structured_output": true, "parallelism": true, "model_selection": true, "reasoning_effort": true, "long_context": true, "multimodal": false, "plugins": true, "hooks": true, "commands": true},
    "model_selection": {"task": "SUPPORTED", "stage": "UNKNOWN", "subagent": "SUPPORTED", "step": "UNKNOWN"},
    "permissions": {"policy_gated": true, "supported_levels": ["read-only", "workspace-write"], "declared_scopes": []},
    "evidence_provenance": {"evidence_class": "HOST_MANAGED_FIXTURE", "source": "checked-in capability fixture", "method": "static-contract-fixture", "notes": "No verified executable was probed; fixture is not live evidence."}
  }
]
